{
  "valid": true,
  "backend": "clipper2-rust 1.2.0",
  "units": "mm",
  "maximum_overlap_ratio": 0.0,
  "maximum_total_overlap_ratio": 0.0,
  "maximum_outside_ratio": 0.0,
  "violation_count": 0,
  "violations": [],
  "metrics": {
    "sheets_used": 2,
    "placed_parts": 178,
    "requested_parts": 178,
    "placed_area": 2738107.601747329,
    "placed_priority": 178.0,
    "full_stock_area": 6250000.0,
    "material_area": 5114581.3825,
    "normalized_material": 1.6366660424000001,
    "utilization": 0.5353532179810473,
    "trailing_offcut_area": 1135418.6175,
    "last_sheet_id": "sheet-1",
    "last_sheet_used_height": 1591.665106
  }
}
